[{"categoryId":"animals","correctOptionId":"o0","difficulty":"easy","id":"animals_cheetah_sprint_0001","image":null,"localizations":{"en":{"explanation":"Cheetahs are sprinters and cannot sustain their top speed for long.","question":"Which land mammal runs fastest over a short distance?"},"ru":{"explanation":"Гепард — спринтер: высокую скорость он поддерживает недолго.","question":"Какое наземное млекопитающее быстрее всех бежит на короткой дистанции?"}},"options":[{"en":"Cheetah","id":"o0","ru":"Гепард"},{"en":"Lion","id":"o1","ru":"Лев"},{"en":"Wolf","id":"o2","ru":"Волк"},{"en":"Hyena","id":"o3","ru":"Гиена"}],"revision":1,"sources":["https://animals.sandiegozoo.org/animals/cheetah"],"type":"single_choice"},{"categoryId":"animals","correctOptionId":"o0","difficulty":"medium","id":"animals_cheetah_tail_0001","image":null,"localizations":{"en":{"explanation":"The tail acts as a rudder to help the animal maintain direction.","question":"What helps a cheetah steer while running fast?"},"ru":{"explanation":"Хвост работает как руль и помогает управлять движением.","question":"Что помогает гепарду удерживать направление при быстром беге?"}},"options":[{"en":"A long tail","id":"o0","ru":"Длинный хвост"},{"en":"A neck mane","id":"o1","ru":"Грива на шее"},{"en":"Elongated ears","id":"o2","ru":"Удлинённые уши"},{"en":"Coat spots","id":"o3","ru":"Пятна на шерсти"}],"revision":1,"sources":["https://animals.sandiegozoo.org/animals/cheetah"],"type":"single_choice"},{"categoryId":"animals","correctOptionId":"o0","difficulty":"easy","id":"animals_giraffe_height_0001","image":null,"localizations":{"en":{"explanation":"Its long neck and legs help a giraffe reach high branches.","question":"Which land animal is the tallest?"},"ru":{"explanation":"Длинные шея и ноги позволяют жирафу доставать высокие ветви.","question":"Какое наземное животное самое высокое?"}},"options":[{"en":"Giraffe","id":"o0","ru":"Жираф"},{"en":"Elephant","id":"o1","ru":"Слон"},{"en":"Rhinoceros","id":"o2","ru":"Носорог"},{"en":"Hippopotamus","id":"o3","ru":"Бегемот"}],"revision":1,"sources":["https://animals.sandiegozoo.org/animals/giraffe"],"type":"single_choice"},{"categoryId":"animals","correctOptionId":"o0","difficulty":"medium","id":"animals_giraffe_neck_0001","image":null,"localizations":{"en":{"explanation":"The number matches humans, but each vertebra is much longer.","question":"How many neck vertebrae does a giraffe normally have?"},"ru":{"explanation":"Их столько же, сколько у человека, но каждый позвонок значительно длиннее.","question":"Сколько шейных позвонков обычно у жирафа?"}},"options":[{"en":"7","id":"o0","ru":"7"},{"en":"14","id":"o1","ru":"14"},{"en":"21","id":"o2","ru":"21"},{"en":"28","id":"o3","ru":"28"}],"revision":1,"sources":["https://animals.sandiegozoo.org/animals/giraffe"],"type":"single_choice"},{"categoryId":"animals","correctOptionId":"o0","difficulty":"hard","id":"animals_giraffe_relative_0001","image":null,"localizations":{"en":{"explanation":"The okapi and giraffe belong to the giraffe family.","question":"Which animal is the giraffe’s closest living relative?"},"ru":{"explanation":"Окапи и жираф относятся к семейству жирафовых.","question":"Какое животное — ближайший современный родственник жирафа?"}},"options":[{"en":"Okapi","id":"o0","ru":"Окапи"},{"en":"Zebra","id":"o1","ru":"Зебра"},{"en":"Moose","id":"o2","ru":"Лось"},{"en":"Camel","id":"o3","ru":"Верблюд"}],"revision":1,"sources":["https://animals.sandiegozoo.org/animals/giraffe"],"type":"single_choice"},{"categoryId":"animals","correctOptionId":"o0","difficulty":"easy","id":"animals_panda_diet_0001","image":null,"localizations":{"en":{"explanation":"Pandas eat shoots and leaves, peeling the tough outer layers from stalks.","question":"Which plant makes up most of a giant panda’s diet?"},"ru":{"explanation":"Панда ест побеги и листья, снимая с побегов жёсткий наружный слой.","question":"Какое растение составляет основу рациона большой панды?"}},"options":[{"en":"Bamboo","id":"o0","ru":"Бамбук"},{"en":"Eucalyptus","id":"o1","ru":"Эвкалипт"},{"en":"Cactus","id":"o2","ru":"Кактус"},{"en":"Fern","id":"o3","ru":"Папоротник"}],"revision":1,"sources":["https://animals.sandiegozoo.org/animals/giant-panda"],"type":"single_choice"},{"categoryId":"animals","correctOptionId":"o0","difficulty":"hard","id":"animals_panda_thumb_0001","image":null,"localizations":{"en":{"explanation":"This bone helps pandas grasp and manipulate bamboo stalks.","question":"What forms a giant panda’s “false thumb”?"},"ru":{"explanation":"Эта кость помогает панде удерживать и поворачивать бамбуковые стебли.","question":"Из чего образован «ложный большой палец» большой панды?"}},"options":[{"en":"An enlarged wrist bone","id":"o0","ru":"Увеличенная кость запястья"},{"en":"An extra claw","id":"o1","ru":"Дополнительный коготь"},{"en":"Two fused digits","id":"o2","ru":"Сросшиеся два пальца"},{"en":"A cartilage projection of the elbow","id":"o3","ru":"Хрящевой отросток локтя"}],"revision":1,"sources":["https://animals.sandiegozoo.org/animals/giant-panda"],"type":"single_choice"},{"categoryId":"animals","correctOptionId":"o0","difficulty":"medium","id":"animals_platypus_bill_0001","image":null,"localizations":{"en":{"explanation":"Electroreceptors help locate prey while its eyes are closed underwater.","question":"Which signals does a platypus’s bill detect when it searches for prey?"},"ru":{"explanation":"Электрорецепторы помогают искать добычу, когда глаза под водой закрыты.","question":"Какие сигналы помогает обнаруживать клюв утконоса при поиске добычи?"}},"options":[{"en":"Electrical impulses","id":"o0","ru":"Электрические импульсы"},{"en":"FM radio waves","id":"o1","ru":"Радиоволны FM"},{"en":"X-rays","id":"o2","ru":"Рентгеновские лучи"},{"en":"Ultraviolet light","id":"o3","ru":"Ультрафиолетовый свет"}],"revision":1,"sources":["https://animals.sandiegozoo.org/animals/platypus"],"type":"single_choice"},{"categoryId":"animals","correctOptionId":"o0","difficulty":"easy","id":"animals_platypus_eggs_0001","image":null,"localizations":{"en":{"explanation":"Platypuses are monotremes and feed their young with milk.","question":"Which of these mammals lays eggs?"},"ru":{"explanation":"Утконос относится к однопроходным; детёнышей он кормит молоком.","question":"Какое из этих млекопитающих откладывает яйца?"}},"options":[{"en":"Platypus","id":"o0","ru":"Утконос"},{"en":"Otter","id":"o1","ru":"Выдра"},{"en":"Beaver","id":"o2","ru":"Бобр"},{"en":"Dolphin","id":"o3","ru":"Дельфин"}],"revision":1,"sources":["https://animals.sandiegozoo.org/animals/platypus"],"type":"single_choice"},{"categoryId":"animals","correctOptionId":"o0","difficulty":"medium","id":"animals_platypus_habitat_0001","image":null,"localizations":{"en":{"explanation":"They live mainly in streams, rivers, lakes and ponds.","question":"In what kind of water do platypuses usually forage?"},"ru":{"explanation":"Они обитают преимущественно в ручьях, реках, озёрах и прудах.","question":"В какой воде утконосы обычно ищут пищу?"}},"options":[{"en":"Fresh water","id":"o0","ru":"В пресной"},{"en":"The open ocean","id":"o1","ru":"В открытом океане"},{"en":"Salt lakes","id":"o2","ru":"В солёных озёрах"},{"en":"Deep seas","id":"o3","ru":"В глубоководных морях"}],"revision":1,"sources":["https://animals.sandiegozoo.org/animals/platypus"],"type":"single_choice"}]
