[{"categoryId":"video_games","correctOptionId":"o0","difficulty":"hard","id":"video_games_guitar_hero_debut_0001","image":null,"localizations":{"en":{"explanation":"The music game let players perform rock tracks using a guitar controller.","question":"On which console did the Guitar Hero series begin in 2005?"},"ru":{"explanation":"Музыкальная игра предлагала исполнять рок-композиции с контроллером-гитарой.","question":"На какой консоли в 2005 году началась серия Guitar Hero?"}},"options":[{"en":"PlayStation 2","id":"o0","ru":"PlayStation 2"},{"en":"Nintendo 64","id":"o1","ru":"Nintendo 64"},{"en":"Sega Saturn","id":"o2","ru":"Sega Saturn"},{"en":"PlayStation 4","id":"o3","ru":"PlayStation 4"}],"revision":1,"sources":["https://www.playstation.com/en-ae/playstation-history/2000-ps2-psp/"],"type":"single_choice"},{"categoryId":"video_games","correctOptionId":"o0","difficulty":"hard","id":"video_games_ps1_chip_0001","image":null,"localizations":{"en":{"explanation":"It was a 32-bit processor used for tasks including 3D graphics.","question":"Which CPU did the original PlayStation use?"},"ru":{"explanation":"Это был 32-разрядный процессор, рассчитанный в том числе на трёхмерную графику.","question":"Какой процессор использовала первая PlayStation?"}},"options":[{"en":"R3000","id":"o0","ru":"R3000"},{"en":"Emotion Engine","id":"o1","ru":"Emotion Engine"},{"en":"Cell","id":"o2","ru":"Cell"},{"en":"Motorola 68000","id":"o3","ru":"Motorola 68000"}],"revision":1,"sources":["https://www.playstation.com/en-ae/playstation-history/1994-ps-one/"],"type":"single_choice"},{"categoryId":"video_games","correctOptionId":"o0","difficulty":"easy","id":"video_games_ps1_disc_0001","image":null,"localizations":{"en":{"explanation":"Optical discs could hold more data than contemporary cartridges.","question":"Which medium carried games for the original PlayStation?"},"ru":{"explanation":"Оптические диски позволяли хранить больше данных, чем картриджи того времени.","question":"На каких носителях распространялись игры первой PlayStation?"}},"options":[{"en":"CD-ROM","id":"o0","ru":"CD-ROM"},{"en":"UMD","id":"o1","ru":"UMD"},{"en":"Blu-ray","id":"o2","ru":"Blu-ray"},{"en":"HD DVD","id":"o3","ru":"HD DVD"}],"revision":1,"sources":["https://www.playstation.com/en-ae/playstation-history/1994-ps-one/"],"type":"single_choice"},{"categoryId":"video_games","correctOptionId":"o0","difficulty":"easy","id":"video_games_ps1_japan_year_0001","image":null,"localizations":{"en":{"explanation":"North America and Europe received the console the following year.","question":"In which year was the original PlayStation released in Japan?"},"ru":{"explanation":"В Северной Америке и Европе её выпуск состоялся в следующем году.","question":"В каком году первая PlayStation вышла в Японии?"}},"options":[{"en":"1994","id":"o0","ru":"1994"},{"en":"1984","id":"o1","ru":"1984"},{"en":"2004","id":"o2","ru":"2004"},{"en":"2014","id":"o3","ru":"2014"}],"revision":1,"sources":["https://www.playstation.com/en-ae/playstation-history/1994-ps-one/"],"type":"single_choice"},{"categoryId":"video_games","correctOptionId":"o0","difficulty":"medium","id":"video_games_ps2_cpu_0001","image":null,"localizations":{"en":{"explanation":"The processor helped produce complex game imagery for its era.","question":"What was the CPU of PlayStation 2 called?"},"ru":{"explanation":"Процессор участвовал в создании сложных для своего времени игровых изображений.","question":"Как назывался центральный процессор PlayStation 2?"}},"options":[{"en":"Emotion Engine","id":"o0","ru":"Emotion Engine"},{"en":"Cell Broadband Engine","id":"o1","ru":"Cell Broadband Engine"},{"en":"Xenon","id":"o2","ru":"Xenon"},{"en":"Tegra X1","id":"o3","ru":"Tegra X1"}],"revision":1,"sources":["https://www.playstation.com/en-ae/playstation-history/2000-ps2-psp/"],"type":"single_choice"},{"categoryId":"video_games","correctOptionId":"o0","difficulty":"easy","id":"video_games_ps2_dvd_0001","image":null,"localizations":{"en":{"explanation":"Built-in movie playback made the console a home multimedia device.","question":"Which video format could PlayStation 2 play without a separate player?"},"ru":{"explanation":"Встроенное воспроизведение фильмов делало консоль домашним мультимедийным устройством.","question":"Какой формат видео PlayStation 2 позволяла смотреть без отдельного плеера?"}},"options":[{"en":"DVD","id":"o0","ru":"DVD"},{"en":"Blu-ray","id":"o1","ru":"Blu-ray"},{"en":"HD DVD","id":"o2","ru":"HD DVD"},{"en":"UMD Video","id":"o3","ru":"UMD Video"}],"revision":1,"sources":["https://www.playstation.com/en-ae/playstation-history/2000-ps2-psp/"],"type":"single_choice"},{"categoryId":"video_games","correctOptionId":"o0","difficulty":"easy","id":"video_games_ps2_japan_year_0001","image":null,"localizations":{"en":{"explanation":"It launched in Japan in March and in Europe in November of the same year.","question":"In which year did PlayStation 2 go on sale in Japan?"},"ru":{"explanation":"Японский запуск состоялся в марте, европейский — в ноябре того же года.","question":"В каком году PlayStation 2 поступила в продажу в Японии?"}},"options":[{"en":"2000","id":"o0","ru":"2000"},{"en":"1990","id":"o1","ru":"1990"},{"en":"2005","id":"o2","ru":"2005"},{"en":"2010","id":"o3","ru":"2010"}],"revision":1,"sources":["https://www.playstation.com/en-ae/playstation-history/2000-ps2-psp/"],"type":"single_choice"},{"categoryId":"video_games","correctOptionId":"o0","difficulty":"medium","id":"video_games_ps2_network_0001","image":null,"localizations":{"en":{"explanation":"The adapter fitted at the back and provided a network connection.","question":"Which accessory enabled early PS2 models to connect online?"},"ru":{"explanation":"Адаптер устанавливался сзади и давал консоли сетевое соединение.","question":"Какое дополнение помогало ранним моделям PS2 подключаться к сети?"}},"options":[{"en":"Network Adaptor","id":"o0","ru":"Network Adaptor"},{"en":"PlayTV","id":"o1","ru":"PlayTV"},{"en":"PS VR","id":"o2","ru":"PS VR"},{"en":"PocketStation","id":"o3","ru":"PocketStation"}],"revision":1,"sources":["https://www.playstation.com/en-ae/playstation-history/2000-ps2-psp/"],"type":"single_choice"},{"categoryId":"video_games","correctOptionId":"o0","difficulty":"medium","id":"video_games_ps2_slim_0001","image":null,"localizations":{"en":{"explanation":"The smaller model included an Ethernet port for online play.","question":"What was the thinner PlayStation 2 model released in 2004 called?"},"ru":{"explanation":"Уменьшенная модель получила встроенный Ethernet-порт для сетевой игры.","question":"Как называлась более тонкая версия PlayStation 2, выпущенная в 2004 году?"}},"options":[{"en":"PS2 Slim","id":"o0","ru":"PS2 Slim"},{"en":"PS2 Pro","id":"o1","ru":"PS2 Pro"},{"en":"PS2 Go","id":"o2","ru":"PS2 Go"},{"en":"PS2 Classic","id":"o3","ru":"PS2 Classic"}],"revision":1,"sources":["https://www.playstation.com/en-ae/playstation-history/2000-ps2-psp/"],"type":"single_choice"},{"categoryId":"video_games","correctOptionId":"o0","difficulty":"medium","id":"video_games_singstar_play_0001","image":null,"localizations":{"en":{"explanation":"The series scored players’ vocal performances of familiar songs.","question":"Which accessory do players use in the karaoke series SingStar?"},"ru":{"explanation":"Серия оценивала вокальное исполнение знакомых песен.","question":"Какой аксессуар нужен игрокам в караоке-серии SingStar?"}},"options":[{"en":"Microphone","id":"o0","ru":"Микрофон"},{"en":"Steering wheel","id":"o1","ru":"Руль"},{"en":"Light gun","id":"o2","ru":"Световой пистолет"},{"en":"Dance mat","id":"o3","ru":"Танцевальный коврик"}],"revision":1,"sources":["https://www.playstation.com/en-ae/playstation-history/2000-ps2-psp/"],"type":"single_choice"}]
