[{"categoryId":"space_technology","correctOptionId":"o0","difficulty":"easy","id":"space_technology_armstrong_first_0001","image":null,"localizations":{"en":{"explanation":"Armstrong stepped out first, followed by Aldrin.","question":"Who was the first person to step onto the Moon?"},"ru":{"explanation":"Первым вышел Армстронг, за ним на поверхность спустился Олдрин.","question":"Кто первым ступил на поверхность Луны?"}},"options":[{"en":"Neil Armstrong","id":"o0","ru":"Нил Армстронг"},{"en":"Buzz Aldrin","id":"o1","ru":"Базз Олдрин"},{"en":"Michael Collins","id":"o2","ru":"Майкл Коллинз"},{"en":"Alan Shepard","id":"o3","ru":"Алан Шепард"}],"revision":1,"sources":["https://www.nasa.gov/mission/apollo-11/"],"type":"single_choice"},{"categoryId":"space_technology","correctOptionId":"o0","difficulty":"medium","id":"space_technology_collins_role_0001","image":null,"localizations":{"en":{"explanation":"Collins piloted the command module and rendezvoused with the returning lunar module.","question":"Who piloted Apollo 11’s command module while two astronauts were on the Moon?"},"ru":{"explanation":"Коллинз управлял командным модулем и встретил возвращавшийся лунный модуль.","question":"Кто пилотировал командный модуль «Аполлона-11», пока двое астронавтов были на Луне?"}},"options":[{"en":"Michael Collins","id":"o0","ru":"Майкл Коллинз"},{"en":"Eugene Cernan","id":"o1","ru":"Юджин Сернан"},{"en":"John Young","id":"o2","ru":"Джон Янг"},{"en":"David Scott","id":"o3","ru":"Дэвид Скотт"}],"revision":1,"sources":["https://www.nasa.gov/mission/apollo-11/"],"type":"single_choice"},{"categoryId":"space_technology","correctOptionId":"o0","difficulty":"easy","id":"space_technology_eagle_module_0001","image":null,"localizations":{"en":{"explanation":"Eagle carried Armstrong and Aldrin to the Moon while Collins remained in orbit.","question":"What was the name of Apollo 11’s lunar module?"},"ru":{"explanation":"Eagle доставил Армстронга и Олдрина на Луну; Коллинз оставался на орбите.","question":"Как назывался лунный модуль миссии «Аполлон-11»?"}},"options":[{"en":"Eagle","id":"o0","ru":"Eagle"},{"en":"Columbia","id":"o1","ru":"Columbia"},{"en":"Challenger","id":"o2","ru":"Challenger"},{"en":"Endeavour","id":"o3","ru":"Endeavour"}],"revision":1,"sources":["https://www.nasa.gov/mission/apollo-11/"],"type":"single_choice"},{"categoryId":"space_technology","correctOptionId":"o0","difficulty":"easy","id":"space_technology_first_moon_mission_0001","image":null,"localizations":{"en":{"explanation":"Apollo 11 landed on the Moon in July 1969.","question":"Which mission first landed humans on the Moon?"},"ru":{"explanation":"Лунная посадка «Аполлона-11» состоялась в июле 1969 года.","question":"Какая миссия впервые доставила людей на поверхность Луны?"}},"options":[{"en":"Apollo 11","id":"o0","ru":"Аполлон-11"},{"en":"Apollo 8","id":"o1","ru":"Аполлон-8"},{"en":"Gemini IV","id":"o2","ru":"Джемини-4"},{"en":"Vostok 1","id":"o3","ru":"Восток-1"}],"revision":1,"sources":["https://www.nasa.gov/mission/apollo-11/"],"type":"single_choice"},{"categoryId":"space_technology","correctOptionId":"o0","difficulty":"hard","id":"space_technology_heliosphere_boundary_0001","image":null,"localizations":{"en":{"explanation":"Leaving the heliosphere does not mean the spacecraft has passed the entire Oort Cloud.","question":"Which boundary did Voyager 1 cross in 2012 to enter interstellar space?"},"ru":{"explanation":"Выход из гелиосферы не означает, что аппарат уже миновал всё облако Оорта.","question":"Какую границу пересёк «Вояджер-1» в 2012 году, выйдя в межзвёздную среду?"}},"options":[{"en":"The heliosphere boundary","id":"o0","ru":"Границу гелиосферы"},{"en":"The outer Oort Cloud edge","id":"o1","ru":"Внешний край облака Оорта"},{"en":"The asteroid belt’s inner edge","id":"o2","ru":"Внутренний край пояса астероидов"},{"en":"The Kuiper Belt’s outer edge","id":"o3","ru":"Внешний край пояса Койпера"}],"revision":1,"sources":["https://science.nasa.gov/mission/voyager/frequently-asked-questions/"],"type":"single_choice"},{"categoryId":"space_technology","correctOptionId":"o0","difficulty":"medium","id":"space_technology_io_volcanoes_0001","image":null,"localizations":{"en":{"explanation":"It was the first observation of active volcanism on another solar-system body.","question":"On which moon did Voyager discover active volcanoes?"},"ru":{"explanation":"Это стало первым наблюдением действующего вулканизма на другом небесном теле.","question":"На каком спутнике аппараты «Вояджер» обнаружили действующие вулканы?"}},"options":[{"en":"Io","id":"o0","ru":"Ио"},{"en":"Europa","id":"o1","ru":"Европа"},{"en":"Callisto","id":"o2","ru":"Каллисто"},{"en":"Titan","id":"o3","ru":"Титан"}],"revision":1,"sources":["https://science.nasa.gov/mission/voyager/frequently-asked-questions/"],"type":"single_choice"},{"categoryId":"space_technology","correctOptionId":"o0","difficulty":"medium","id":"space_technology_pale_blue_dot_0001","image":null,"localizations":{"en":{"explanation":"Voyager 1’s cameras were pointed back to make a portrait of the solar system.","question":"Which spacecraft photographed Earth in the famous 1990 Pale Blue Dot image?"},"ru":{"explanation":"Камеры «Вояджера-1» повернули назад для съёмки портрета Солнечной системы.","question":"Какой аппарат снял Землю на известном снимке Pale Blue Dot в 1990 году?"}},"options":[{"en":"Voyager 1","id":"o0","ru":"Вояджер-1"},{"en":"Voyager 2","id":"o1","ru":"Вояджер-2"},{"en":"Pioneer 10","id":"o2","ru":"Пионер-10"},{"en":"Mariner 10","id":"o3","ru":"Маринер-10"}],"revision":1,"sources":["https://science.nasa.gov/mission/voyager/frequently-asked-questions/"],"type":"single_choice"},{"categoryId":"space_technology","correctOptionId":"o0","difficulty":"hard","id":"space_technology_titan_trajectory_0001","image":null,"localizations":{"en":{"explanation":"The Titan encounter sent the spacecraft out of the planetary plane, ending further planetary flybys.","question":"Studying which moon influenced Voyager 1’s trajectory at Saturn?"},"ru":{"explanation":"Пролёт у Титана направил аппарат из плоскости планет и исключил дальнейшие планетные встречи.","question":"Изучение какого спутника повлияло на траекторию «Вояджера-1» у Сатурна?"}},"options":[{"en":"Titan","id":"o0","ru":"Титана"},{"en":"Triton","id":"o1","ru":"Тритона"},{"en":"Charon","id":"o2","ru":"Харона"},{"en":"Phobos","id":"o3","ru":"Фобоса"}],"revision":1,"sources":["https://science.nasa.gov/mission/voyager/frequently-asked-questions/"],"type":"single_choice"},{"categoryId":"space_technology","correctOptionId":"o0","difficulty":"easy","id":"space_technology_voyager_record_0001","image":null,"localizations":{"en":{"explanation":"The record carries sounds and images representing Earth.","question":"What do the Voyager spacecraft carry as a message about Earth?"},"ru":{"explanation":"На пластинке собраны звуки и изображения, представляющие Землю.","question":"Что несут аппараты «Вояджер» как послание о Земле?"}},"options":[{"en":"A golden phonograph record","id":"o0","ru":"Золотую грампластинку"},{"en":"A silver photographic film","id":"o1","ru":"Серебряную фотоплёнку"},{"en":"A quartz optical disc","id":"o2","ru":"Кварцевый оптический диск"},{"en":"A magnetic audio cassette","id":"o3","ru":"Магнитную аудиокассету"}],"revision":1,"sources":["https://science.nasa.gov/mission/voyager/frequently-asked-questions/"],"type":"single_choice"},{"categoryId":"space_technology","correctOptionId":"o0","difficulty":"medium","id":"space_technology_voyager_uranus_neptune_0001","image":null,"localizations":{"en":{"explanation":"After Jupiter and Saturn, Voyager 2 continued to the two outer planets.","question":"Which spacecraft flew by both Uranus and Neptune in the 1980s?"},"ru":{"explanation":"После Юпитера и Сатурна «Вояджер-2» продолжил путь к двум внешним планетам.","question":"Какой аппарат пролетел и мимо Урана, и мимо Нептуна в 1980-х годах?"}},"options":[{"en":"Voyager 2","id":"o0","ru":"Вояджер-2"},{"en":"Voyager 1","id":"o1","ru":"Вояджер-1"},{"en":"Galileo","id":"o2","ru":"Галилео"},{"en":"Cassini","id":"o3","ru":"Кассини"}],"revision":1,"sources":["https://science.nasa.gov/mission/voyager/frequently-asked-questions/"],"type":"single_choice"}]
