[{"categoryId":"natural_wonders","correctOptionId":"o0","difficulty":"easy","id":"natural_wonders_baikal_deepest_0001","image":null,"localizations":{"en":{"explanation":"Lake Baikal in Siberia is also among the oldest lakes on Earth.","question":"Which lake is the deepest in the world?"},"ru":{"explanation":"Байкал в Сибири также относится к древнейшим озёрам Земли.","question":"Какое озеро является самым глубоким в мире?"}},"options":[{"en":"Lake Baikal","id":"o0","ru":"Байкал"},{"en":"Lake Victoria","id":"o1","ru":"Виктория"},{"en":"Lake Ladoga","id":"o2","ru":"Ладожское"},{"en":"Lake Superior","id":"o3","ru":"Верхнее"}],"revision":1,"sources":["https://whc.unesco.org/en/list/754/"],"type":"single_choice"},{"categoryId":"natural_wonders","correctOptionId":"o0","difficulty":"easy","id":"natural_wonders_barrier_reef_builders_0001","image":null,"localizations":{"en":{"explanation":"The Great Barrier Reef off north-eastern Australia consists of many coral reefs.","question":"Which animals build the reef structures of the Great Barrier Reef?"},"ru":{"explanation":"Большой Барьерный риф у северо-востока Австралии состоит из множества коралловых рифов.","question":"Какие животные создают рифовые структуры Большого Барьерного рифа?"}},"options":[{"en":"Coral polyps","id":"o0","ru":"Коралловые полипы"},{"en":"Jellyfish","id":"o1","ru":"Медузы"},{"en":"Starfish","id":"o2","ru":"Морские звёзды"},{"en":"Crabs","id":"o3","ru":"Крабы"}],"revision":1,"sources":["https://whc.unesco.org/en/list/154/"],"type":"single_choice"},{"categoryId":"natural_wonders","correctOptionId":"o0","difficulty":"hard","id":"natural_wonders_cappadocia_erosion_0001","image":null,"localizations":{"en":{"explanation":"Erosion shaped Göreme’s landscape, where people carved sanctuaries and dwellings into rock.","question":"Which process sculpted Göreme’s distinctive landscape in Cappadocia?"},"ru":{"explanation":"Эрозия создала рельеф Гёреме, где люди вырубали в скалах святилища и жилища.","question":"Какой процесс сформировал характерный рельеф Гёреме в Каппадокии?"}},"options":[{"en":"Erosion","id":"o0","ru":"Эрозия"},{"en":"Coral growth","id":"o1","ru":"Рост кораллов"},{"en":"Peat formation","id":"o2","ru":"Образование торфяников"},{"en":"Sea ice accumulation","id":"o3","ru":"Накопление морского льда"}],"revision":1,"sources":["https://whc.unesco.org/en/list/357/"],"type":"single_choice"},{"categoryId":"natural_wonders","correctOptionId":"o0","difficulty":"easy","id":"natural_wonders_galapagos_ocean_0001","image":null,"localizations":{"en":{"explanation":"Isolation of these volcanic Pacific islands helped distinctive local species evolve.","question":"In which ocean are the Galápagos Islands?"},"ru":{"explanation":"Изоляция вулканических островов в Тихом океане способствовала появлению необычных местных видов.","question":"В каком океане находятся Галапагосские острова?"}},"options":[{"en":"Pacific","id":"o0","ru":"Тихий"},{"en":"Atlantic","id":"o1","ru":"Атлантический"},{"en":"Indian","id":"o2","ru":"Индийский"},{"en":"Arctic","id":"o3","ru":"Северный Ледовитый"}],"revision":1,"sources":["https://whc.unesco.org/en/list/1/"],"type":"single_choice"},{"categoryId":"natural_wonders","correctOptionId":"o0","difficulty":"easy","id":"natural_wonders_grand_canyon_river_0001","image":null,"localizations":{"en":{"explanation":"The Grand Canyon was shaped by erosion associated with the Colorado River.","question":"Which river carved the Grand Canyon in Arizona?"},"ru":{"explanation":"Большой каньон образован эрозией, связанной с рекой Колорадо.","question":"Какая река прорезала Большой каньон в Аризоне?"}},"options":[{"en":"Colorado","id":"o0","ru":"Колорадо"},{"en":"Mississippi","id":"o1","ru":"Миссисипи"},{"en":"Amazon","id":"o2","ru":"Амазонка"},{"en":"Nile","id":"o3","ru":"Нил"}],"revision":1,"sources":["https://whc.unesco.org/en/list/75/"],"type":"single_choice"},{"categoryId":"natural_wonders","correctOptionId":"o0","difficulty":"hard","id":"natural_wonders_huangshan_rock_0001","image":null,"localizations":{"en":{"explanation":"Granite peaks are a defining feature of Huangshan’s landscape in China.","question":"Which rock forms the famous peaks of Huangshan?"},"ru":{"explanation":"Гранитные пики — характерная особенность ландшафта Хуаншаня в Китае.","question":"Из какой горной породы сложены знаменитые пики Хуаншаня?"}},"options":[{"en":"Granite","id":"o0","ru":"Гранит"},{"en":"Chalk","id":"o1","ru":"Мел"},{"en":"Coal","id":"o2","ru":"Уголь"},{"en":"Rock salt","id":"o3","ru":"Каменная соль"}],"revision":1,"sources":["https://whc.unesco.org/en/list/547/"],"type":"single_choice"},{"categoryId":"natural_wonders","correctOptionId":"o0","difficulty":"medium","id":"natural_wonders_iguazu_border_0001","image":null,"localizations":{"en":{"explanation":"The waterfall complex straddles the Argentina–Brazil border.","question":"On the border of which countries are Iguazu Falls?"},"ru":{"explanation":"Комплекс водопадов пересекает границу Аргентины и Бразилии.","question":"На границе каких стран находятся водопады Игуасу?"}},"options":[{"en":"Argentina and Brazil","id":"o0","ru":"Аргентина и Бразилия"},{"en":"Chile and Peru","id":"o1","ru":"Чили и Перу"},{"en":"Bolivia and Paraguay","id":"o2","ru":"Боливия и Парагвай"},{"en":"Venezuela and Colombia","id":"o3","ru":"Венесуэла и Колумбия"}],"revision":1,"sources":["https://whc.unesco.org/en/list/303/"],"type":"single_choice"},{"categoryId":"natural_wonders","correctOptionId":"o0","difficulty":"medium","id":"natural_wonders_komodo_animals_0001","image":null,"localizations":{"en":{"explanation":"Komodo dragons are giant lizards protected in this island national park.","question":"Which large reptiles gave Komodo National Park its name?"},"ru":{"explanation":"Комодские вараны — гигантские ящерицы, охраняемые в этом островном парке.","question":"Какие крупные пресмыкающиеся дали название национальному парку Комодо?"}},"options":[{"en":"Komodo dragons","id":"o0","ru":"Комодские вараны"},{"en":"Nile crocodiles","id":"o1","ru":"Нильские крокодилы"},{"en":"Green iguanas","id":"o2","ru":"Зелёные игуаны"},{"en":"Tuataras","id":"o3","ru":"Гаттерии"}],"revision":1,"sources":["https://whc.unesco.org/en/list/609/"],"type":"single_choice"},{"categoryId":"natural_wonders","correctOptionId":"o0","difficulty":"medium","id":"natural_wonders_serengeti_migration_0001","image":null,"localizations":{"en":{"explanation":"Large herds of wildebeest, zebras and gazelles move across the savannah.","question":"Which annual natural event is the Serengeti especially known for?"},"ru":{"explanation":"По саванне перемещаются огромные стада гну, зебр и газелей.","question":"Каким ежегодным природным событием особенно известен Серенгети?"}},"options":[{"en":"Migration of hoofed mammals","id":"o0","ru":"Миграцией копытных"},{"en":"Migration of whales","id":"o1","ru":"Миграцией китов"},{"en":"Salmon spawning","id":"o2","ru":"Нерестом лососей"},{"en":"Sea turtle nesting","id":"o3","ru":"Выходом морских черепах"}],"revision":1,"sources":["https://whc.unesco.org/en/list/156/"],"type":"single_choice"},{"categoryId":"natural_wonders","correctOptionId":"o0","difficulty":"medium","id":"natural_wonders_victoria_river_0001","image":null,"localizations":{"en":{"explanation":"The Zambezi drops into deep basalt gorges at Victoria Falls.","question":"On which river are Victoria Falls?"},"ru":{"explanation":"Замбези падает в глубокие базальтовые ущелья, образуя водопад Виктория.","question":"На какой реке находится водопад Виктория?"}},"options":[{"en":"Zambezi","id":"o0","ru":"Замбези"},{"en":"Congo","id":"o1","ru":"Конго"},{"en":"Nile","id":"o2","ru":"Нил"},{"en":"Niger","id":"o3","ru":"Нигер"}],"revision":1,"sources":["https://whc.unesco.org/en/list/509/"],"type":"single_choice"}]
