[{"categoryId":"artificial_intelligence","correctOptionId":"o0","difficulty":"hard","id":"artificial_intelligence_cluster_labels_0001","image":null,"localizations":{"en":{"explanation":"A person can assign meanings or names to discovered clusters afterward.","question":"Must group names be predefined for unsupervised clustering?"},"ru":{"explanation":"Найденным кластерам человек может дать названия уже после анализа.","question":"Нужно ли заранее задавать названия групп при кластеризации без учителя?"}},"options":[{"en":"No, groups are found by similarity","id":"o0","ru":"Нет, группы находят по сходству"},{"en":"Yes, these are required labels","id":"o1","ru":"Да, это обязательные метки"},{"en":"Yes, a classifier defines them","id":"o2","ru":"Да, группы задаёт классификатор"},{"en":"Yes, each name is a reward","id":"o3","ru":"Да, название служит наградой"}],"revision":1,"sources":["https://developers.google.com/machine-learning/intro-to-ml/what-is-ml"],"type":"single_choice"},{"categoryId":"artificial_intelligence","correctOptionId":"o0","difficulty":"easy","id":"artificial_intelligence_data_training_0001","image":null,"localizations":{"en":{"explanation":"A model learns patterns in data and uses them to make predictions.","question":"What does a machine learning model extract patterns from during training?"},"ru":{"explanation":"Модель выявляет закономерности в данных и использует их для прогнозов.","question":"Из чего модель машинного обучения извлекает закономерности при обучении?"}},"options":[{"en":"Data examples","id":"o0","ru":"Примеры данных"},{"en":"Only manually fixed answers","id":"o1","ru":"Только вручную заданные ответы"},{"en":"Only a list of ready-made commands","id":"o2","ru":"Только список готовых команд"},{"en":"Only random predictions","id":"o3","ru":"Только случайные прогнозы"}],"revision":1,"sources":["https://developers.google.com/machine-learning/intro-to-ml/what-is-ml"],"type":"single_choice"},{"categoryId":"artificial_intelligence","correctOptionId":"o0","difficulty":"easy","id":"artificial_intelligence_generative_output_0001","image":null,"localizations":{"en":{"explanation":"Generative models create content rather than only assigning a predefined label.","question":"Which type of AI creates new text, images, or music?"},"ru":{"explanation":"Генеративные модели создают содержимое, а не только присваивают готовую метку.","question":"Какой вид ИИ создаёт новый текст, изображения или музыку?"}},"options":[{"en":"Generative AI","id":"o0","ru":"Генеративный ИИ"},{"en":"Clustering alone","id":"o1","ru":"Только кластеризация"},{"en":"Numeric regression alone","id":"o2","ru":"Только числовая регрессия"},{"en":"Binary classification alone","id":"o3","ru":"Только двоичная классификация"}],"revision":1,"sources":["https://developers.google.com/machine-learning/intro-to-ml/what-is-ml"],"type":"single_choice"},{"categoryId":"artificial_intelligence","correctOptionId":"o0","difficulty":"easy","id":"artificial_intelligence_labeled_examples_0001","image":null,"localizations":{"en":{"explanation":"Labeled examples link input data to known target answers.","question":"What is learning from examples with known correct answers called?"},"ru":{"explanation":"Размеченные примеры связывают входные данные с целевыми ответами.","question":"Как называется обучение на примерах с известными правильными ответами?"}},"options":[{"en":"Supervised learning","id":"o0","ru":"Обучение с учителем"},{"en":"Unsupervised learning","id":"o1","ru":"Обучение без учителя"},{"en":"Reinforcement learning","id":"o2","ru":"Обучение с подкреплением"},{"en":"Random search","id":"o3","ru":"Случайный поиск"}],"revision":1,"sources":["https://developers.google.com/machine-learning/intro-to-ml/what-is-ml"],"type":"single_choice"},{"categoryId":"artificial_intelligence","correctOptionId":"o0","difficulty":"medium","id":"artificial_intelligence_multiclass_0001","image":null,"localizations":{"en":{"explanation":"A multiclass classifier chooses among more than two classes.","question":"Classifying an image as cat, dog, or horse is which kind of classification?"},"ru":{"explanation":"Многоклассовый классификатор выбирает среди более чем двух классов.","question":"Распознавание «кошка», «собака» или «лошадь» — какая классификация?"}},"options":[{"en":"Multiclass","id":"o0","ru":"Многоклассовая"},{"en":"Binary","id":"o1","ru":"Двоичная"},{"en":"Numeric regression","id":"o2","ru":"Числовая регрессия"},{"en":"Unlabeled clustering","id":"o3","ru":"Кластеризация без меток"}],"revision":1,"sources":["https://developers.google.com/machine-learning/intro-to-ml/what-is-ml"],"type":"single_choice"},{"categoryId":"artificial_intelligence","correctOptionId":"o0","difficulty":"hard","id":"artificial_intelligence_policy_0001","image":null,"localizations":{"en":{"explanation":"A policy guides the agent in choosing actions to obtain rewards.","question":"What does a policy specify in reinforcement learning?"},"ru":{"explanation":"Стратегия направляет выбор действий агента для получения награды.","question":"Что задаёт policy в обучении с подкреплением?"}},"options":[{"en":"An action-selection strategy","id":"o0","ru":"Стратегию выбора действий"},{"en":"Only a past reward list","id":"o1","ru":"Только список наград в прошлом"},{"en":"Only the training-example count","id":"o2","ru":"Только число обучающих примеров"},{"en":"Only the class names","id":"o3","ru":"Только названия классов"}],"revision":1,"sources":["https://developers.google.com/machine-learning/intro-to-ml/what-is-ml"],"type":"single_choice"},{"categoryId":"artificial_intelligence","correctOptionId":"o0","difficulty":"medium","id":"artificial_intelligence_regression_price_0001","image":null,"localizations":{"en":{"explanation":"Regression predicts a numeric quantity such as a price.","question":"Which model type suits predicting a numeric house price?"},"ru":{"explanation":"Регрессия предсказывает числовую величину, например цену.","question":"Какой тип модели подходит для прогноза числовой цены дома?"}},"options":[{"en":"Regression","id":"o0","ru":"Регрессия"},{"en":"Binary classification","id":"o1","ru":"Двоичная классификация"},{"en":"Multiclass classification","id":"o2","ru":"Многоклассовая классификация"},{"en":"Clustering","id":"o3","ru":"Кластеризация"}],"revision":1,"sources":["https://developers.google.com/machine-learning/intro-to-ml/what-is-ml"],"type":"single_choice"},{"categoryId":"artificial_intelligence","correctOptionId":"o0","difficulty":"medium","id":"artificial_intelligence_reward_learning_0001","image":null,"localizations":{"en":{"explanation":"An agent acts in an environment and learns from the resulting rewards.","question":"Which approach trains an agent through rewards and penalties for actions?"},"ru":{"explanation":"Агент выбирает действия в среде и учится по полученной награде.","question":"Какой подход обучает агента через награды и штрафы за действия?"}},"options":[{"en":"Reinforcement learning","id":"o0","ru":"Обучение с подкреплением"},{"en":"Unsupervised learning","id":"o1","ru":"Обучение без учителя"},{"en":"Learning from labeled answers","id":"o2","ru":"Обучение на размеченных ответах"},{"en":"Clustering","id":"o3","ru":"Кластеризация"}],"revision":1,"sources":["https://developers.google.com/machine-learning/intro-to-ml/what-is-ml"],"type":"single_choice"},{"categoryId":"artificial_intelligence","correctOptionId":"o0","difficulty":"easy","id":"artificial_intelligence_spam_task_0001","image":null,"localizations":{"en":{"explanation":"A classifier selects a category; this task has two categories.","question":"Which task assigns emails to spam and not-spam categories?"},"ru":{"explanation":"Классификатор выбирает категорию; здесь их две.","question":"К какой задаче относится распределение писем на «спам» и «не спам»?"}},"options":[{"en":"Classification","id":"o0","ru":"Классификация"},{"en":"Regression","id":"o1","ru":"Регрессия"},{"en":"Unlabeled clustering","id":"o2","ru":"Кластеризация без меток"},{"en":"Text generation","id":"o3","ru":"Генерация текста"}],"revision":1,"sources":["https://developers.google.com/machine-learning/intro-to-ml/what-is-ml"],"type":"single_choice"},{"categoryId":"artificial_intelligence","correctOptionId":"o0","difficulty":"medium","id":"artificial_intelligence_unlabeled_groups_0001","image":null,"localizations":{"en":{"explanation":"Clusters group similar items without predefined class labels.","question":"What does clustering typically find in unlabeled data?"},"ru":{"explanation":"Кластеры объединяют похожие объекты без заранее заданных меток классов.","question":"Что обычно ищет кластеризация в неразмеченных данных?"}},"options":[{"en":"Groups of similar items","id":"o0","ru":"Группы похожих объектов"},{"en":"An exact future price","id":"o1","ru":"Точное будущее значение цены"},{"en":"A fixed answer for each label","id":"o2","ru":"Готовый ответ для каждой метки"},{"en":"New text from a prompt","id":"o3","ru":"Новый текст по запросу"}],"revision":1,"sources":["https://developers.google.com/machine-learning/intro-to-ml/what-is-ml"],"type":"single_choice"}]
