[{"categoryId":"tennis","correctOptionId":"o0","difficulty":"hard","id":"tennis_change_ends_0001","image":null,"localizations":{"en":{"explanation":"The standard rule changes ends every six points; approved alternative formats can differ.","question":"After how many points do players change ends in a standard ITF 2026 tie-break?"},"ru":{"explanation":"Основное правило — смена после каждых шести очков; для альтернативных форматов есть исключения.","question":"Через сколько очков меняют стороны в стандартном тай-брейке по ITF 2026?"}},"options":[{"en":"Every six points","id":"o0","ru":"После каждых шести"},{"en":"Every two points","id":"o1","ru":"После каждых двух"},{"en":"Every three points","id":"o2","ru":"После каждых трёх"},{"en":"Only at its end","id":"o3","ru":"Только по окончании"}],"revision":1,"sources":["https://www.itftennis.com/media/7221/2026-rules-of-tennis-english.pdf"],"type":"single_choice"},{"categoryId":"tennis","correctOptionId":"o0","difficulty":"medium","id":"tennis_court_length_0001","image":null,"localizations":{"en":{"explanation":"Singles and doubles courts have the same length but different widths.","question":"How long is a standard tennis court under the 2026 ITF rules?"},"ru":{"explanation":"Длина одинакова для одиночной и парной игры; различается ширина.","question":"Какова длина стандартного теннисного корта по правилам ITF 2026 года?"}},"options":[{"en":"23.77 m","id":"o0","ru":"23,77 м"},{"en":"28 m","id":"o1","ru":"28 м"},{"en":"18 m","id":"o2","ru":"18 м"},{"en":"20 m","id":"o3","ru":"20 м"}],"revision":1,"sources":["https://www.itftennis.com/media/7221/2026-rules-of-tennis-english.pdf"],"type":"single_choice"},{"categoryId":"tennis","correctOptionId":"o0","difficulty":"easy","id":"tennis_deuce_score_0001","image":null,"localizations":{"en":{"explanation":"After deuce, two consecutive points are needed to win a standard game.","question":"What is 40–40 called in a standard tennis game?"},"ru":{"explanation":"После «ровно» для победы в стандартном гейме нужны два очка подряд.","question":"Как называют счёт 40:40 в стандартном теннисном гейме?"}},"options":[{"en":"Deuce","id":"o0","ru":"Ровно"},{"en":"Advantage","id":"o1","ru":"Больше"},{"en":"Tie-break","id":"o2","ru":"Тай-брейк"},{"en":"Match point","id":"o3","ru":"Матчбол"}],"revision":1,"sources":["https://www.itftennis.com/media/7221/2026-rules-of-tennis-english.pdf"],"type":"single_choice"},{"categoryId":"tennis","correctOptionId":"o0","difficulty":"easy","id":"tennis_diagonal_serve_0001","image":null,"localizations":{"en":{"explanation":"A serve crosses the net and lands in the diagonally opposite service court.","question":"Where must a legal tennis serve land?"},"ru":{"explanation":"Подача пересекает сетку и попадает в поле подачи по диагонали.","question":"В какое поле должна попасть правильная подача в теннисе?"}},"options":[{"en":"The diagonally opposite service court","id":"o0","ru":"В диагонально противоположное поле подачи"},{"en":"Anywhere beyond the baseline","id":"o1","ru":"В любое место за задней линией"},{"en":"The service court straight ahead","id":"o2","ru":"В поле подачи прямо напротив"},{"en":"Either doubles alley","id":"o3","ru":"В любой парный коридор"}],"revision":1,"sources":["https://www.itftennis.com/media/7221/2026-rules-of-tennis-english.pdf"],"type":"single_choice"},{"categoryId":"tennis","correctOptionId":"o0","difficulty":"medium","id":"tennis_first_serve_side_0001","image":null,"localizations":{"en":{"explanation":"The server then alternates between the right and left halves.","question":"From which half does serving start in each standard game?"},"ru":{"explanation":"Далее подающий чередует правую и левую половины.","question":"С какой половины начинается подача в каждом стандартном гейме?"}},"options":[{"en":"The right half","id":"o0","ru":"С правой"},{"en":"The left half","id":"o1","ru":"С левой"},{"en":"Always the center","id":"o2","ru":"Всегда из центра"},{"en":"The receiver chooses","id":"o3","ru":"На выбор принимающего"}],"revision":1,"sources":["https://www.itftennis.com/media/7221/2026-rules-of-tennis-english.pdf"],"type":"single_choice"},{"categoryId":"tennis","correctOptionId":"o0","difficulty":"easy","id":"tennis_line_touch_0001","image":null,"localizations":{"en":{"explanation":"A line is part of the court area it bounds.","question":"A ball touches the boundary line of the required court area. How is it judged?"},"ru":{"explanation":"Линия считается частью участка корта, который она ограничивает.","question":"Мяч коснулся ограничивающей линии нужного участка корта. Как его оценивают?"}},"options":[{"en":"In that court area","id":"o0","ru":"Попал в этот участок"},{"en":"Always out","id":"o1","ru":"Всегда аут"},{"en":"Always replayed","id":"o2","ru":"Всегда переигровка"},{"en":"Always a double fault","id":"o3","ru":"Всегда двойная ошибка"}],"revision":1,"sources":["https://www.itftennis.com/media/7221/2026-rules-of-tennis-english.pdf"],"type":"single_choice"},{"categoryId":"tennis","correctOptionId":"o0","difficulty":"easy","id":"tennis_love_score_0001","image":null,"localizations":{"en":{"explanation":"A standard game starts at zero, called love in tennis scoring.","question":"What does love mean in tennis scoring?"},"ru":{"explanation":"В стандартном гейме счёт начинается с нуля, который называют love.","question":"Что означает love при объявлении счёта в теннисе?"}},"options":[{"en":"Zero points","id":"o0","ru":"Ноль очков"},{"en":"One point","id":"o1","ru":"Одно очко"},{"en":"A won set","id":"o2","ru":"Выигранный сет"},{"en":"An interval","id":"o3","ru":"Перерыв"}],"revision":1,"sources":["https://www.itftennis.com/media/7221/2026-rules-of-tennis-english.pdf"],"type":"single_choice"},{"categoryId":"tennis","correctOptionId":"o0","difficulty":"medium","id":"tennis_singles_width_0001","image":null,"localizations":{"en":{"explanation":"The doubles alleys increase the court width to 10.97 m.","question":"How wide is a singles tennis court under the 2026 ITF rules?"},"ru":{"explanation":"Парные коридоры увеличивают ширину корта до 10,97 м.","question":"Какова ширина одиночного теннисного корта по правилам ITF 2026 года?"}},"options":[{"en":"8.23 m","id":"o0","ru":"8,23 м"},{"en":"10.97 m","id":"o1","ru":"10,97 м"},{"en":"12.80 m","id":"o2","ru":"12,80 м"},{"en":"6.40 m","id":"o3","ru":"6,40 м"}],"revision":1,"sources":["https://www.itftennis.com/media/7221/2026-rules-of-tennis-english.pdf"],"type":"single_choice"},{"categoryId":"tennis","correctOptionId":"o0","difficulty":"medium","id":"tennis_tiebreak_margin_0001","image":null,"localizations":{"en":{"explanation":"The tie-break continues until one player or team leads by two points.","question":"At 6–6 in a standard seven-point tie-break, what is needed to win?"},"ru":{"explanation":"Тай-брейк продолжается, пока один участник не получит отрыв в два очка.","question":"При счёте 6:6 в обычном тай-брейке до семи очков что нужно для победы?"}},"options":[{"en":"A two-point lead","id":"o0","ru":"Отрыв в два очка"},{"en":"Only the next point","id":"o1","ru":"Только одно следующее очко"},{"en":"Exactly ten points each","id":"o2","ru":"Ровно десять очков у обоих"},{"en":"Winning a toss","id":"o3","ru":"Победа в жеребьёвке"}],"revision":1,"sources":["https://www.itftennis.com/media/7221/2026-rules-of-tennis-english.pdf"],"type":"single_choice"},{"categoryId":"tennis","correctOptionId":"o0","difficulty":"hard","id":"tennis_tiebreak_service_0001","image":null,"localizations":{"en":{"explanation":"The initial server serves one point; turns of two points follow.","question":"Who serves the second and third points of a standard tennis tie-break?"},"ru":{"explanation":"Первый подающий выполняет одну подачу, затем участники подают по два очка.","question":"Кто подаёт второе и третье очки стандартного теннисного тай-брейка?"}},"options":[{"en":"The first server’s opponent","id":"o0","ru":"Соперник первого подающего"},{"en":"The first server","id":"o1","ru":"Первый подающий"},{"en":"One point each","id":"o2","ru":"По одному очку каждый"},{"en":"A new toss decides","id":"o3","ru":"Определяют новой жеребьёвкой"}],"revision":1,"sources":["https://www.itftennis.com/media/7221/2026-rules-of-tennis-english.pdf"],"type":"single_choice"}]
