[{"categoryId":"biology","correctOptionId":"o0","difficulty":"medium","id":"biology_adenine_partner_0001","image":null,"localizations":{"en":{"explanation":"In DNA, adenine pairs with thymine, while guanine pairs with cytosine.","question":"Which base pairs with adenine in ordinary double-stranded DNA?"},"ru":{"explanation":"В ДНК аденин образует пару с тимином, а гуанин — с цитозином.","question":"С каким основанием аденин образует пару в обычной двуцепочечной ДНК?"}},"options":[{"en":"Thymine","id":"o0","ru":"Тимин"},{"en":"Cytosine","id":"o1","ru":"Цитозин"},{"en":"Guanine","id":"o2","ru":"Гуанин"},{"en":"Uracil","id":"o3","ru":"Урацил"}],"revision":1,"sources":["https://www.genome.gov/genetics-glossary"],"type":"single_choice"},{"categoryId":"biology","correctOptionId":"o0","difficulty":"medium","id":"biology_dna_replication_0001","image":null,"localizations":{"en":{"explanation":"Replication copies DNA so daughter cells receive genetic information.","question":"What is the copying of DNA before cell division called?"},"ru":{"explanation":"Репликация создаёт копию ДНК, чтобы дочерние клетки получили генетическую информацию.","question":"Как называется копирование ДНК перед делением клетки?"}},"options":[{"en":"Replication","id":"o0","ru":"Репликация"},{"en":"Translation","id":"o1","ru":"Трансляция"},{"en":"Diffusion","id":"o2","ru":"Диффузия"},{"en":"Osmosis","id":"o3","ru":"Осмос"}],"revision":1,"sources":["https://www.genome.gov/genetics-glossary"],"type":"single_choice"},{"categoryId":"biology","correctOptionId":"o0","difficulty":"easy","id":"biology_hereditary_molecule_0001","image":null,"localizations":{"en":{"explanation":"Chromosomes contain DNA, whose base sequence encodes genetic information.","question":"Which molecule stores genetic information in human chromosomes?"},"ru":{"explanation":"Хромосомы содержат ДНК. Последовательность её оснований кодирует наследственную информацию.","question":"Какая молекула хранит генетическую информацию в хромосомах человека?"}},"options":[{"en":"DNA","id":"o0","ru":"ДНК"},{"en":"Haemoglobin","id":"o1","ru":"Гемоглобин"},{"en":"Starch","id":"o2","ru":"Крахмал"},{"en":"Collagen","id":"o3","ru":"Коллаген"}],"revision":1,"sources":["https://www.genome.gov/genetics-glossary"],"type":"single_choice"},{"categoryId":"biology","correctOptionId":"o0","difficulty":"easy","id":"biology_mitosis_0001","image":null,"localizations":{"en":{"explanation":"During mitosis, chromosome copies are distributed between two new nuclei.","question":"What is nuclear division that preserves chromosome number called?"},"ru":{"explanation":"При митозе копии хромосом распределяются между двумя новыми ядрами.","question":"Как называется деление ядра клетки с сохранением числа хромосом?"}},"options":[{"en":"Mitosis","id":"o0","ru":"Митоз"},{"en":"Meiosis","id":"o1","ru":"Мейоз"},{"en":"Transcription","id":"o2","ru":"Транскрипция"},{"en":"Translation","id":"o3","ru":"Трансляция"}],"revision":1,"sources":["https://www.genome.gov/genetics-glossary"],"type":"single_choice"},{"categoryId":"biology","correctOptionId":"o0","difficulty":"medium","id":"biology_mutation_definition_0001","image":null,"localizations":{"en":{"explanation":"A mutation changes a DNA sequence and does not necessarily cause disease.","question":"What is a change in a DNA sequence called?"},"ru":{"explanation":"Мутация — изменение последовательности ДНК; она не обязательно приводит к болезни.","question":"Как называют изменение последовательности ДНК?"}},"options":[{"en":"Mutation","id":"o0","ru":"Мутация"},{"en":"Diffusion","id":"o1","ru":"Диффузия"},{"en":"Photosynthesis","id":"o2","ru":"Фотосинтез"},{"en":"Osmosis","id":"o3","ru":"Осмос"}],"revision":1,"sources":["https://www.genome.gov/genetics-glossary"],"type":"single_choice"},{"categoryId":"biology","correctOptionId":"o0","difficulty":"hard","id":"biology_nucleolus_role_0001","image":null,"localizations":{"en":{"explanation":"The nucleolus produces ribosomal RNA and assembles ribosome components.","question":"Which structure within the nucleus helps produce and assemble ribosomes?"},"ru":{"explanation":"В ядрышке образуется рибосомная РНК и собираются компоненты рибосом.","question":"Какая структура ядра участвует в образовании и сборке рибосом?"}},"options":[{"en":"Nucleolus","id":"o0","ru":"Ядрышко"},{"en":"Centromere","id":"o1","ru":"Центромера"},{"en":"Telomere","id":"o2","ru":"Теломера"},{"en":"Lysosome","id":"o3","ru":"Лизосома"}],"revision":1,"sources":["https://www.genome.gov/genetics-glossary"],"type":"single_choice"},{"categoryId":"biology","correctOptionId":"o0","difficulty":"easy","id":"biology_nucleus_location_0001","image":null,"localizations":{"en":{"explanation":"A membrane separates the nucleus from the cytoplasm; the nucleus contains the cell’s chromosomes.","question":"Where are chromosomes located in a typical human cell with a nucleus?"},"ru":{"explanation":"Ядро отделено мембраной от цитоплазмы и содержит хромосомы клетки.","question":"Где находятся хромосомы в обычной ядросодержащей клетке человека?"}},"options":[{"en":"In the nucleus","id":"o0","ru":"В ядре"},{"en":"In lysosomes","id":"o1","ru":"В лизосомах"},{"en":"In the Golgi apparatus","id":"o2","ru":"В аппарате Гольджи"},{"en":"In ribosomes","id":"o3","ru":"В рибосомах"}],"revision":1,"sources":["https://www.genome.gov/genetics-glossary"],"type":"single_choice"},{"categoryId":"biology","correctOptionId":"o0","difficulty":"easy","id":"biology_protein_blocks_0001","image":null,"localizations":{"en":{"explanation":"Proteins are chains of amino acids that fold into a particular structure.","question":"What molecules form protein chains?"},"ru":{"explanation":"Белки состоят из цепочек аминокислот, которые затем складываются в определённую структуру.","question":"Из каких молекул состоят цепочки белков?"}},"options":[{"en":"Amino acids","id":"o0","ru":"Аминокислоты"},{"en":"Nucleotides","id":"o1","ru":"Нуклеотиды"},{"en":"Fatty acids","id":"o2","ru":"Жирные кислоты"},{"en":"Monosaccharides","id":"o3","ru":"Моносахариды"}],"revision":1,"sources":["https://www.genome.gov/genetics-glossary"],"type":"single_choice"},{"categoryId":"biology","correctOptionId":"o0","difficulty":"medium","id":"biology_ribosome_role_0001","image":null,"localizations":{"en":{"explanation":"A ribosome reads messenger RNA and assembles an amino acid chain.","question":"Which cellular structure is a site of protein synthesis?"},"ru":{"explanation":"Рибосома считывает матричную РНК и собирает цепочку аминокислот.","question":"Какая клеточная структура служит местом синтеза белка?"}},"options":[{"en":"Ribosome","id":"o0","ru":"Рибосома"},{"en":"Lysosome","id":"o1","ru":"Лизосома"},{"en":"Vacuole","id":"o2","ru":"Вакуоль"},{"en":"Cell membrane","id":"o3","ru":"Клеточная мембрана"}],"revision":1,"sources":["https://www.genome.gov/genetics-glossary"],"type":"single_choice"},{"categoryId":"biology","correctOptionId":"o0","difficulty":"hard","id":"biology_rna_base_0001","image":null,"localizations":{"en":{"explanation":"RNA uses uracil, and its nucleotides contain ribose rather than deoxyribose.","question":"Which base is usually used in RNA instead of thymine?"},"ru":{"explanation":"В РНК используется урацил. Сахар её нуклеотидов — рибоза, а не дезоксирибоза.","question":"Какое основание обычно используется в РНК вместо тимина?"}},"options":[{"en":"Uracil","id":"o0","ru":"Урацил"},{"en":"Adenine","id":"o1","ru":"Аденин"},{"en":"Guanine","id":"o2","ru":"Гуанин"},{"en":"Cytosine","id":"o3","ru":"Цитозин"}],"revision":1,"sources":["https://www.genome.gov/genetics-glossary"],"type":"single_choice"}]
