[{"categoryId":"cities","correctOptionId":"o0","difficulty":"easy","id":"cities_athens_parthenon_0001","image":null,"localizations":{"en":{"explanation":"The Parthenon is one of the monuments built on the Athenian Acropolis in the fifth century BCE.","question":"Which city is home to the Parthenon on the Acropolis?"},"ru":{"explanation":"Парфенон — один из памятников афинского Акрополя, созданных в V веке до н. э.","question":"В каком городе находится Парфенон на Акрополе?"}},"options":[{"en":"Athens","id":"o0","ru":"Афины"},{"en":"Rome","id":"o1","ru":"Рим"},{"en":"Istanbul","id":"o2","ru":"Стамбул"},{"en":"Alexandria","id":"o3","ru":"Александрия"}],"revision":1,"sources":["https://whc.unesco.org/en/list/404/"],"type":"single_choice"},{"categoryId":"cities","correctOptionId":"o0","difficulty":"medium","id":"cities_florence_uffizi_0001","image":null,"localizations":{"en":{"explanation":"The Uffizi is a landmark of Florence, a historic centre of Renaissance art.","question":"Which city is home to the Uffizi Gallery?"},"ru":{"explanation":"Уффици — один из памятников Флоренции, исторического центра искусства Возрождения.","question":"В каком городе расположена галерея Уффици?"}},"options":[{"en":"Florence","id":"o0","ru":"Флоренция"},{"en":"Milan","id":"o1","ru":"Милан"},{"en":"Venice","id":"o2","ru":"Венеция"},{"en":"Naples","id":"o3","ru":"Неаполь"}],"revision":1,"sources":["https://whc.unesco.org/en/list/174/"],"type":"single_choice"},{"categoryId":"cities","correctOptionId":"o0","difficulty":"medium","id":"cities_granada_alhambra_0001","image":null,"localizations":{"en":{"explanation":"The Alhambra and Generalife gardens form part of a shared World Heritage site in Granada.","question":"Which Spanish city is home to the Alhambra?"},"ru":{"explanation":"Альгамбра и сады Хенералифе входят в общий объект Всемирного наследия в Гранаде.","question":"В каком испанском городе находится Альгамбра?"}},"options":[{"en":"Granada","id":"o0","ru":"Гранада"},{"en":"Seville","id":"o1","ru":"Севилья"},{"en":"Córdoba","id":"o2","ru":"Кордова"},{"en":"Toledo","id":"o3","ru":"Толедо"}],"revision":1,"sources":["https://whc.unesco.org/en/list/314/"],"type":"single_choice"},{"categoryId":"cities","correctOptionId":"o0","difficulty":"easy","id":"cities_istanbul_hagia_sophia_0001","image":null,"localizations":{"en":{"explanation":"The sixth-century Hagia Sophia is part of the Historic Areas of Istanbul.","question":"Which city is home to Hagia Sophia?"},"ru":{"explanation":"Айя-София VI века входит в исторические районы Стамбула.","question":"В каком городе находится собор Святой Софии — Айя-София?"}},"options":[{"en":"Istanbul","id":"o0","ru":"Стамбул"},{"en":"Ankara","id":"o1","ru":"Анкара"},{"en":"Athens","id":"o2","ru":"Афины"},{"en":"Thessaloniki","id":"o3","ru":"Салоники"}],"revision":1,"sources":["https://whc.unesco.org/en/list/356/"],"type":"single_choice"},{"categoryId":"cities","correctOptionId":"o0","difficulty":"hard","id":"cities_kyoto_capital_0001","image":null,"localizations":{"en":{"explanation":"Kyoto remained the imperial capital until the mid-nineteenth century.","question":"Which Japanese city was founded as an imperial capital in 794?"},"ru":{"explanation":"Киото оставался императорской столицей до середины XIX века.","question":"Какой японский город был основан как императорская столица в 794 году?"}},"options":[{"en":"Kyoto","id":"o0","ru":"Киото"},{"en":"Tokyo","id":"o1","ru":"Токио"},{"en":"Osaka","id":"o2","ru":"Осака"},{"en":"Kobe","id":"o3","ru":"Кобе"}],"revision":1,"sources":["https://whc.unesco.org/en/list/688/"],"type":"single_choice"},{"categoryId":"cities","correctOptionId":"o0","difficulty":"easy","id":"cities_paris_seine_0001","image":null,"localizations":{"en":{"explanation":"The banks of the Seine connect Paris landmarks including the Louvre and Notre-Dame.","question":"Which river runs through the historic centre of Paris?"},"ru":{"explanation":"Берега Сены объединяют многие памятники Парижа, включая Лувр и собор Парижской Богоматери.","question":"Какая река проходит через исторический центр Парижа?"}},"options":[{"en":"Seine","id":"o0","ru":"Сена"},{"en":"Thames","id":"o1","ru":"Темза"},{"en":"Tiber","id":"o2","ru":"Тибр"},{"en":"Danube","id":"o3","ru":"Дунай"}],"revision":1,"sources":["https://whc.unesco.org/en/list/600/"],"type":"single_choice"},{"categoryId":"cities","correctOptionId":"o0","difficulty":"medium","id":"cities_prague_charles_bridge_0001","image":null,"localizations":{"en":{"explanation":"Charles Bridge is part of Prague’s historic centre, alongside Prague Castle.","question":"Which city is home to Charles Bridge?"},"ru":{"explanation":"Карлов мост входит в исторический центр Праги вместе с Пражским Градом.","question":"В каком городе находится Карлов мост?"}},"options":[{"en":"Prague","id":"o0","ru":"Прага"},{"en":"Budapest","id":"o1","ru":"Будапешт"},{"en":"Vienna","id":"o2","ru":"Вена"},{"en":"Warsaw","id":"o3","ru":"Варшава"}],"revision":1,"sources":["https://whc.unesco.org/en/list/616/"],"type":"single_choice"},{"categoryId":"cities","correctOptionId":"o0","difficulty":"medium","id":"cities_rome_pantheon_0001","image":null,"localizations":{"en":{"explanation":"The Pantheon is part of Rome’s historic heritage, alongside the forums and Trajan’s Column.","question":"In which city does the ancient Roman Pantheon survive?"},"ru":{"explanation":"Пантеон входит в историческое наследие Рима наряду с форумами и колонной Траяна.","question":"В каком городе сохранился древнеримский Пантеон?"}},"options":[{"en":"Rome","id":"o0","ru":"Рим"},{"en":"Athens","id":"o1","ru":"Афины"},{"en":"Paris","id":"o2","ru":"Париж"},{"en":"Istanbul","id":"o3","ru":"Стамбул"}],"revision":1,"sources":["https://whc.unesco.org/en/list/91/"],"type":"single_choice"},{"categoryId":"cities","correctOptionId":"o0","difficulty":"hard","id":"cities_seville_giralda_0001","image":null,"localizations":{"en":{"explanation":"The Giralda forms part of Seville’s cathedral complex.","question":"Which city is known for the Giralda tower?"},"ru":{"explanation":"Хиральда входит в ансамбль кафедрального собора Севильи.","question":"Какой город известен башней Хиральда?"}},"options":[{"en":"Seville","id":"o0","ru":"Севилья"},{"en":"Granada","id":"o1","ru":"Гранада"},{"en":"Madrid","id":"o2","ru":"Мадрид"},{"en":"Valencia","id":"o3","ru":"Валенсия"}],"revision":1,"sources":["https://whc.unesco.org/en/list/383/"],"type":"single_choice"},{"categoryId":"cities","correctOptionId":"o0","difficulty":"easy","id":"cities_venice_lagoon_0001","image":null,"localizations":{"en":{"explanation":"Historic Venice developed on lagoon islands; UNESCO describes a group of 118 islands.","question":"Which city stands on islands in a lagoon of the same name?"},"ru":{"explanation":"Историческая Венеция возникла на островах лагуны. В описании ЮНЕСКО указаны 118 островов.","question":"Какой город расположен на островах одноимённой лагуны?"}},"options":[{"en":"Venice","id":"o0","ru":"Венеция"},{"en":"Florence","id":"o1","ru":"Флоренция"},{"en":"Prague","id":"o2","ru":"Прага"},{"en":"Seville","id":"o3","ru":"Севилья"}],"revision":1,"sources":["https://whc.unesco.org/en/list/394/"],"type":"single_choice"}]
