[{"categoryId":"ancient_world","correctOptionId":"o0","difficulty":"hard","id":"ancient_world_colosseum_opening_0001","image":null,"localizations":{"en":{"explanation":"The celebrations marking the amphitheater’s opening lasted one hundred days.","question":"In which year AD did Titus hold games to mark the opening of the Colosseum?"},"ru":{"explanation":"Празднества по случаю открытия амфитеатра продолжались сто дней.","question":"В каком году н. э. Тит устроил игры по случаю открытия Колизея?"}},"options":[{"en":"80","id":"o0","ru":"80"},{"en":"44","id":"o1","ru":"44"},{"en":"117","id":"o2","ru":"117"},{"en":"212","id":"o3","ru":"212"}],"revision":1,"sources":["https://colosseo.it/en/event/blood-and-the-arena/"],"type":"single_choice"},{"categoryId":"ancient_world","correctOptionId":"o0","difficulty":"easy","id":"ancient_world_cuneiform_0001","image":null,"localizations":{"en":{"explanation":"In Mesopotamia, such signs were impressed into soft clay with a reed or wooden stylus. Adaptation: Global-MMLU, Cohere Labs et al., Apache 2.0.","question":"Which ancient writing system takes its name from wedge-shaped signs?"},"ru":{"explanation":"В Месопотамии такие знаки вдавливали в мягкую глину концом тростниковой или деревянной палочки. Адаптация: Global-MMLU, Cohere Labs и др., Apache 2.0.","question":"Какая древняя письменность получила название от клиновидных знаков?"}},"options":[{"en":"Cuneiform","id":"o0","ru":"Клинопись"},{"en":"Egyptian hieroglyphs","id":"o1","ru":"Египетские иероглифы"},{"en":"Phoenician script","id":"o2","ru":"Финикийское письмо"},{"en":"Linear B","id":"o3","ru":"Линейное письмо Б"}],"revision":1,"sources":["https://github.com/iamsomon/questiq-content/blob/f02ed01b9e205553ef37cbf4f1ed1514bb41bce1/credits/global_mmlu_20261023.md#ancient-world-cuneiform-0001","https://www.metmuseum.org/essays/the-origins-of-writing","https://raw.githubusercontent.com/iamsomon/questiq-content/main/imports/global-mmlu/LICENSE-APACHE-2.0.txt"],"type":"single_choice"},{"categoryId":"ancient_world","correctOptionId":"o0","difficulty":"easy","id":"ancient_world_khufu_0001","image":null,"localizations":{"en":{"explanation":"It belongs to the Old Kingdom and the Fourth Dynasty.","question":"For which pharaoh was the Great Pyramid at Giza built?"},"ru":{"explanation":"Её относят к Древнему царству и IV династии.","question":"Для какого фараона была построена Великая пирамида в Гизе?"}},"options":[{"en":"Khufu (Cheops)","id":"o0","ru":"Хуфу (Хеопс)"},{"en":"Djoser","id":"o1","ru":"Джосер"},{"en":"Snefru","id":"o2","ru":"Снофру"},{"en":"Ramesses II","id":"o3","ru":"Рамсес II"}],"revision":1,"sources":["https://egyptianmuseumcairo.eg/historical-timeline/"],"type":"single_choice"},{"categoryId":"ancient_world","correctOptionId":"o0","difficulty":"easy","id":"ancient_world_papyrus_0001","image":null,"localizations":{"en":{"explanation":"Strips were laid in layers and dried under pressure.","question":"What did ancient Egyptians use to make papyrus writing sheets?"},"ru":{"explanation":"Полоски укладывали слоями и сушили под давлением.","question":"Из чего древние египтяне делали листы папируса для письма?"}},"options":[{"en":"The pith of plant stalks","id":"o0","ru":"Из сердцевины стеблей растения"},{"en":"Prepared animal skins","id":"o1","ru":"Из обработанных шкур"},{"en":"Fired clay","id":"o2","ru":"Из обожжённой глины"},{"en":"Thin copper plates","id":"o3","ru":"Из тонких медных пластин"}],"revision":1,"sources":["https://www.metmuseum.org/essays/papyrus-in-ancient-egypt"],"type":"single_choice"},{"categoryId":"ancient_world","correctOptionId":"o0","difficulty":"medium","id":"ancient_world_parthenon_deity_0001","image":null,"localizations":{"en":{"explanation":"The main chamber held Pheidias’s gold-and-ivory statue of the goddess.","question":"To which goddess was the Parthenon in Athens dedicated?"},"ru":{"explanation":"В главном зале стояла созданная Фидием статуя богини из золота и слоновой кости.","question":"Какой богине был посвящён афинский Парфенон?"}},"options":[{"en":"Athena","id":"o0","ru":"Афине"},{"en":"Hera","id":"o1","ru":"Гере"},{"en":"Artemis","id":"o2","ru":"Артемиде"},{"en":"Aphrodite","id":"o3","ru":"Афродите"}],"revision":1,"sources":["https://www.theacropolismuseum.gr/en/exhibit-halls/parthenon-gallery"],"type":"single_choice"},{"categoryId":"ancient_world","correctOptionId":"o0","difficulty":"medium","id":"ancient_world_qin_emperor_0001","image":null,"localizations":{"en":{"explanation":"He was the first emperor of the unified Qin state; unification is dated to 221 BC.","question":"The famous Terracotta Army belongs to the burial complex of which ruler?"},"ru":{"explanation":"Это первый император объединённой державы Цинь; объединение датируют 221 годом до н. э.","question":"С погребальным комплексом какого правителя связана знаменитая Терракотовая армия?"}},"options":[{"en":"Qin Shi Huang","id":"o0","ru":"Цинь Шихуанди"},{"en":"Emperor Wu of Han","id":"o1","ru":"Хань У-ди"},{"en":"Emperor Taizong of Tang","id":"o2","ru":"Тан Тай-цзун"},{"en":"Yongle Emperor","id":"o3","ru":"Юнлэ"}],"revision":1,"sources":["https://whc.unesco.org/en/list/441/"],"type":"single_choice"},{"categoryId":"ancient_world","correctOptionId":"o0","difficulty":"medium","id":"ancient_world_rosetta_scholar_0001","image":null,"localizations":{"en":{"explanation":"Comparing the inscriptions on the stone provided a key to reading ancient Egyptian texts.","question":"Who deciphered Egyptian hieroglyphs in 1822 using the Rosetta Stone?"},"ru":{"explanation":"Камень стал ключом к чтению древнеегипетских текстов благодаря сопоставлению надписей.","question":"Кто расшифровал египетские иероглифы в 1822 году, опираясь на Розеттский камень?"}},"options":[{"en":"Jean-François Champollion","id":"o0","ru":"Жан-Франсуа Шампольон"},{"en":"Howard Carter","id":"o1","ru":"Говард Картер"},{"en":"Heinrich Schliemann","id":"o2","ru":"Генрих Шлиман"},{"en":"Arthur Evans","id":"o3","ru":"Артур Эванс"}],"revision":1,"sources":["https://rosetta-stone.dh.uni-leipzig.de/rs/the-rosetta-stone/index.html"],"type":"single_choice"},{"categoryId":"ancient_world","correctOptionId":"o0","difficulty":"hard","id":"ancient_world_terracotta_discovery_0001","image":null,"localizations":{"en":{"explanation":"The sculptures depict warriors, horses and chariots in the burial complex.","question":"In which year was the Terracotta Army at the first Qin emperor’s mausoleum discovered?"},"ru":{"explanation":"Скульптуры изображают воинов, лошадей и колесницы погребального комплекса.","question":"В каком году была обнаружена Терракотовая армия у мавзолея первого императора Цинь?"}},"options":[{"en":"1974","id":"o0","ru":"1974"},{"en":"1922","id":"o1","ru":"1922"},{"en":"1949","id":"o2","ru":"1949"},{"en":"1987","id":"o3","ru":"1987"}],"revision":1,"sources":["https://whc.unesco.org/en/list/441/"],"type":"single_choice"},{"categoryId":"ancient_world","correctOptionId":"o0","difficulty":"medium","id":"ancient_world_upper_egypt_0001","image":null,"localizations":{"en":{"explanation":"Lower Egypt corresponded to the Nile Delta, while Upper Egypt lay in the southern valley. Adaptation: Global-MMLU, Cohere Labs et al., Apache 2.0.","question":"In which direction from Lower Egypt was Upper Egypt located?"},"ru":{"explanation":"Нижний Египет соответствовал области дельты Нила, Верхний — южной части долины. Адаптация: Global-MMLU, Cohere Labs и др., Apache 2.0.","question":"В каком направлении от Нижнего Египта располагался Верхний Египет?"}},"options":[{"en":"South","id":"o0","ru":"К югу"},{"en":"North","id":"o1","ru":"К северу"},{"en":"East","id":"o2","ru":"К востоку"},{"en":"West","id":"o3","ru":"К западу"}],"revision":1,"sources":["https://github.com/iamsomon/questiq-content/blob/f02ed01b9e205553ef37cbf4f1ed1514bb41bce1/credits/global_mmlu_20261023.md#ancient-world-upper-egypt-0001","https://egyptianmuseumcairo.eg/historical-timeline/","https://raw.githubusercontent.com/iamsomon/questiq-content/main/imports/global-mmlu/LICENSE-APACHE-2.0.txt"],"type":"single_choice"},{"categoryId":"ancient_world","correctOptionId":"o0","difficulty":"easy","id":"ancient_world_vesuvius_0001","image":null,"localizations":{"en":{"explanation":"The eruption also struck Herculaneum; buried buildings preserved evidence of Roman life.","question":"Which volcano buried Pompeii under volcanic material in AD 79?"},"ru":{"explanation":"Извержение затронуло также Геркуланум; погребённые здания сохранили свидетельства римской жизни.","question":"Какой вулкан погреб под изверженными материалами Помпеи в 79 году н. э.?"}},"options":[{"en":"Vesuvius","id":"o0","ru":"Везувий"},{"en":"Etna","id":"o1","ru":"Этна"},{"en":"Stromboli","id":"o2","ru":"Стромболи"},{"en":"Vulcano","id":"o3","ru":"Вулькано"}],"revision":1,"sources":["https://whc.unesco.org/en/list/829/"],"type":"single_choice"}]
